index,ref,voteCount,usabilityRatingNullable,downloadCount,totalBytesNullable,lastUpdated,tags
0,jessicali9530/animal-crossing-new-horizons-nookplaza-dataset,29743,0.8235294,37525,590770,2021-06-08 15:05:09,[simulations]
1,allen-institute-for-ai/CORD-19-research-challenge,10341,0.88235295,158225,19724979450,2022-06-06 19:39:40,"[public health, biology, business, computer science, nlp, covid19]"
2,mlg-ulb/creditcardfraud,9944,0.85294116,505714,69155672,2018-03-23 01:17:27,"[crime, finance]"
3,shivamb/netflix-shows,7344,1.0,321526,1400865,2021-09-27 04:44:36,"[websites, arts and entertainment, movies and tv shows, exploratory data analysis, data visualization]"
4,sudalairajkumar/novel-corona-virus-2019-dataset,5958,0.9705882,400687,8928752,2021-06-24 04:27:25,"[public health, health, law, health conditions, covid19]"
5,paultimothymooney/chest-xray-pneumonia,5582,0.75,213814,2463365435,2018-03-24 19:41:59,"[biology, health, medicine, image, online communities]"
6,gregorut/videogamesales,5153,0.5882353,416455,390286,2016-10-26 09:10:49,"[games, video games]"
7,datasnaek/youtube-new,4943,0.7941176,203155,210575746,2019-06-03 00:56:47,"[languages, popular culture, arts and entertainment, linguistics, internet]"
8,timoboz/data-science-cheat-sheets,4407,0.875,53495,625256639,2020-02-04 19:42:27,"[classification, deep learning]"
9,lava18/google-play-store-apps,4357,0.7058824,208622,2037893,2019-02-03 13:55:47,"[video games, business, computer science, internet, mobile and wireless]"
10,hugomathien/soccer,4167,0.7058824,181741,34297253,2016-10-23 22:31:38,"[games, video games, football, europe, sports, business]"
11,borismarjanovic/price-volume-data-for-all-us-stocks-etfs,3963,0.75,96679,515591518,2017-11-16 14:53:29,"[business, finance, economics, artificial intelligence, investing]"
12,unsdsn/world-happiness,3799,0.85294116,255082,37692,2019-11-27 04:41:47,"[arts and entertainment, religion and belief systems, social science, economics, news]"
13,spscientist/students-performance-in-exams,3661,0.7058824,213808,8907,2018-11-09 18:25:25,"[education, exploratory data analysis, data visualization, standardized testing]"
14,uciml/pima-indians-diabetes-database,3512,0.88235295,366225,9128,2016-10-06 18:31:56,"[india, healthcare, earth and nature, health, diabetes]"
15,zynicide/wine-reviews,3423,0.7941176,178421,53336293,2017-11-27 17:08:04,[alcohol]
16,fivethirtyeight/fivethirtyeight-comic-characters-dataset,3409,0.8235294,22305,611306,2019-04-26 15:01:41,"[business, politics, comics and animation]"
17,neuromusic/avocado-prices,3360,0.9705882,219662,643781,2018-06-06 05:28:35,[food]
18,tmdb/tmdb-movie-metadata,3307,0.8235294,257480,9317430,2017-09-28 01:09:12,"[arts and entertainment, movies and tv shows]"
0,uciml/iris,3262,0.7941176,376851,3687,2016-09-27 07:38:05,[biology]
1,mczielinski/bitcoin-historical-data,3154,1.0,121617,105242372,2021-04-11 19:41:13,"[history, finance, currencies and foreign exchange]"
2,rounakbanik/the-movies-dataset,3142,0.8235294,271487,238862293,2017-11-10 02:40:38,"[popular culture, movies and tv shows, earth and nature]"
3,uciml/breast-cancer-wisconsin-data,3031,0.85294116,272499,49796,2016-09-25 10:49:04,"[healthcare, cancer]"
4,rashikrahmanpritom/heart-attack-analysis-prediction-dataset,2959,1.0,119603,4209,2021-03-22 11:40:59,"[health, classification, binary classification, health conditions, heart conditions]"
5,russellyates88/suicide-rates-overview-1985-to-2016,2915,0.8235294,128094,406636,2018-12-01 19:18:25,"[demographics, economics, news]"
6,dgomonov/new-york-city-airbnb-open-data,2733,1.0,141914,2562692,2019-08-12 16:24:45,"[business, internet, hotels and accommodations]"
7,moltean/fruits,2629,0.875,113569,1379678841,2021-09-12 19:19:48,"[image, multiclass classification, food]"
8,olistbr/brazilian-ecommerce,2631,1.0,176843,44717580,2021-10-01 19:08:27,"[brazil, business, exploratory data analysis, nlp, data visualization, multiclass classification]"
9,fedesoriano/stroke-prediction-dataset,2573,1.0,118678,69007,2021-01-26 19:29:28,"[healthcare, public health, health, binary classification, health conditions]"
10,zalando-research/fashionmnist,2421,0.85294116,146619,72114846,2017-12-07 00:54:20,"[arts and entertainment, earth and nature, clothing and accessories, computer science, image, multiclass classification, retail and shopping]"
11,START-UMD/gtd,2415,0.85294116,87841,30077034,2018-09-10 18:22:18,"[literature, crime, government, international relations, software]"
12,uciml/red-wine-quality-cortez-et-al-2009,2383,0.88235295,173857,26176,2017-11-27 23:41:08,"[alcohol, earth and nature, education, beginner]"
13,abcsds/pokemon,2344,0.88235295,100605,15234,2016-08-29 06:01:43,"[popular culture, games, video games, anime and manga]"
14,blastchar/telco-customer-churn,2334,0.88235295,166697,175758,2018-02-23 18:20:00,[business]
15,mirichoi0218/insurance,2178,0.88235295,172981,16425,2018-02-21 00:15:14,"[healthcare, education, finance, health, insurance]"
16,pavansubhasht/ibm-hr-analytics-attrition-dataset,2158,0.88235295,128475,51314,2017-03-31 06:55:16,"[employment, business, software]"
17,gpreda/covid-world-vaccination-progress,2129,1.0,91627,2034736,2022-03-31 07:55:09,"[public health, biology, health, public safety, covid19]"
18,uciml/mushroom-classification,2103,0.85294116,105386,35057,2016-12-01 23:08:00,"[earth and nature, biology, public safety]"
19,jessemostipak/hotel-booking-demand,2096,1.0,98993,1308365,2020-02-13 01:27:20,"[social science, travel, hotels and accommodations, tidyverse]"
0,berkeleyearth/climate-change-earth-surface-temperature-data,2078,0.7647059,108252,88843537,2017-05-01 17:29:10,"[atmospheric science, environment, business, news]"
1,fedesoriano/heart-failure-prediction,2061,1.0,94644,8762,2021-09-10 18:11:57,"[healthcare, health, classification, health conditions, heart conditions]"
2,snap/amazon-fine-food-reviews,1976,0.7941176,142046,253873708,2017-05-01 18:51:31,"[business, linguistics, internet, restaurants]"
3,harlfoxem/housesalesprediction,1952,0.7058824,161079,798275,2016-08-25 15:52:49,[finance]
4,muratkokludataset/date-fruit-datasets,1951,0.9375,17096,418144,2022-04-03 09:25:39,"[earth and nature, agriculture, computer vision, classification, deep learning, image]"
5,imakash3011/customer-personality-analysis,1945,0.9705882,89014,63450,2021-08-22 18:15:05,"[business, education, exploratory data analysis, data cleaning, classification, clustering]"
6,andrewmvd/heart-failure-clinical-data,1930,1.0,106325,4067,2020-06-20 01:03:20,"[healthcare, public health, health, tabular, heart conditions]"
7,heesoo37/120-years-of-olympic-history-athletes-and-results,1901,0.8235294,127995,5690772,2018-06-15 06:10:41,"[sports, history]"
8,imdevskp/corona-virus-report,1888,1.0,251082,19921674,2020-08-07 03:47:47,"[diseases, public health, law, covid19]"
9,sudalairajkumar/covid19-in-india,1868,0.9117647,182441,776022,2021-08-11 04:14:10,"[public health, health]"
10,sakshigoyal7/credit-card-customers,1845,1.0,78629,387771,2020-11-19 07:38:44,"[business, lending, banking, e-commerce services]"
11,sobhanmoosavi/us-accidents,1766,1.0,83712,282091257,2022-03-12 07:23:02,"[transportation, geospatial analysis, tabular, public safety]"
12,mohansacharya/graduate-admissions,1763,0.7058824,86533,9867,2018-12-28 10:07:14,"[universities and colleges, linear regression, tabular, regression, standardized testing]"
13,alxmamaev/flowers-recognition,1726,0.625,83003,235663188,2021-07-16 16:00:32,"[plants, image, multiclass classification]"
14,uciml/student-alcohol-consumption,1706,0.85294116,118940,18868,2016-10-19 15:52:39,"[universities and colleges, public health, primary and secondary schools]"
15,martj42/international-football-results-from-1872-to-2017,1678,1.0,66764,1106973,2023-03-05 09:32:21,"[football, global, sports, history, international relations]"
16,muratkokludataset/rice-image-dataset,1663,0.875,7837,230059472,2022-04-03 02:12:00,"[agriculture, computer science, computer vision, cnn, image]"
17,muratkokludataset/acoustic-extinguisher-fire-dataset,1652,0.9375,2923,635619,2022-04-02 22:59:36,"[categorical, artificial intelligence, computer science, classification, binary classification]"
18,kaggle/world-development-indicators,1618,0.7647059,64015,387054886,2017-05-01 17:50:44,"[business, economics, international relations]"
19,jealousleopard/goodreadsbooks,1606,1.0,51806,637338,2020-03-09 09:18:31,"[literature, business, demographics, linguistics, internet]"
0,arashnic/fitbit,1602,1.0,77978,25278847,2020-12-16 15:20:03,"[exercise, business]"
1,aungpyaeap/supermarket-sales,1595,0.88235295,155364,36801,2019-05-27 07:08:04,"[business, economics, data visualization]"
2,andrewmvd/face-mask-detection,1570,0.875,60132,416968083,2020-05-22 07:18:42,"[arts and entertainment, art, education, computer vision, image, covid19]"
3,kimjihoo/coronavirusdataset,1566,1.0,127661,7338354,2020-07-13 14:07:31,"[universities and colleges, biology, data visualization, tabular, covid19]"
4,muratkokludataset/pistachio-image-dataset,1547,0.9375,2562,27948410,2022-03-28 18:01:27,"[agriculture, computer vision, classification, deep learning, image]"
5,kashnitsky/mlcourse,1546,0.88235295,37332,53599525,2018-12-09 16:45:09,"[computer science, data visualization, classification, clustering, regression]"
6,kazanova/sentiment140,1547,0.88235295,101918,84855679,2017-09-13 22:43:19,"[languages, linguistics, internet, online communities, social networks]"
7,iabhishekofficial/mobile-price-classification,1543,0.7058824,125396,72340,2018-01-28 08:44:24,"[business, classification]"
8,kemical/kickstarter-projects,1535,0.7941176,67623,38571084,2018-02-08 09:02:30,"[business, finance, crowdfunding]"
9,yelp-dataset/yelp-dataset,1539,0.75,106666,4374983563,2022-03-17 22:59:01,[earth and nature]
10,aaron7sun/stocknews,1531,0.7058824,48155,6097730,2019-11-13 18:22:52,"[business, education, finance, investing, news]"
11,kmader/skin-cancer-mnist-ham10000,1529,0.7058824,78369,5582914511,2018-09-20 20:36:13,"[health, image, multiclass classification]"
12,jsphyg/weather-dataset-rattle-package,1531,1.0,98561,4020790,2020-12-11 10:26:12,"[earth and nature, weather and climate, classification, binary classification]"
13,clmentbisaillon/fake-and-real-news-dataset,1527,0.88235295,81302,42975911,2020-03-26 18:51:15,"[earth and nature, nlp, news]"
14,gpreda/reddit-vaccine-myths,1493,1.0,19821,242965,2022-02-10 18:16:00,"[education, data analytics, pandas]"
15,muratkokludataset/grapevine-leaves-image-dataset,1489,0.875,1611,113980250,2022-04-03 09:00:54,"[agriculture, computer science, computer vision, deep learning, transfer learning]"
16,muratkokludataset/pistachio-dataset,1471,0.9375,1685,1904509,2022-04-03 08:38:21,"[agriculture, computer vision, classification, image, binary classification]"
17,muratkokludataset/pumpkin-seeds-dataset,1466,0.9375,3047,402721,2022-03-28 18:28:16,"[categorical, agriculture, computer science, computer vision, classification]"
18,muratkokludataset/raisin-dataset,1463,0.9375,2241,115045,2022-04-03 00:23:16,"[earth and nature, agriculture, computer science, computer vision, classification]"
19,muratkokludataset/dry-bean-dataset,1456,0.9375,1789,4755362,2022-04-02 23:19:30,"[agriculture, computer science, computer vision, classification, clustering]"
0,muratkokludataset/durum-wheat-dataset,1450,0.9375,412,1030866718,2022-04-03 00:02:29,"[categorical, earth and nature, agriculture, computer science, computer vision, image]"
1,muratkokludataset/rice-msc-dataset,1435,0.9375,830,106750106,2022-04-03 01:33:52,"[categorical, earth and nature, agriculture, computer science, computer vision, classification]"
2,vjchoudhary7/customer-segmentation-tutorial-in-python,1423,0.88235295,117230,1583,2018-08-11 07:23:02,"[business, clustering, investing]"
3,muratkokludataset/rice-dataset-commeo-and-osmancik,1414,0.9375,545,536353,2022-04-03 00:40:03,[earth and nature]
4,carrie1/ecommerce-data,1399,0.7058824,112619,7548686,2017-08-17 02:44:30,"[earth and nature, business, finance, e-commerce services]"
5,jessicali9530/celeba-dataset,1366,0.7647059,93838,1427750792,2018-06-01 20:08:48,"[arts and entertainment, business, computer vision, classification, image, online communities]"
6,ruchi798/data-science-job-salaries,1346,1.0,53628,7542,2022-06-15 08:59:12,"[business, computer science, programming]"
7,roche-data-science-coalition/uncover,1298,0.875,23252,270285254,2022-05-02 16:35:45,"[public health, business, computer science, covid19]"
8,datamunge/sign-language-mnist,1304,0.7647059,74386,65633206,2017-10-20 15:09:18,"[languages, healthcare, linguistics, computer science]"
9,puneet6060/intel-image-classification,1281,0.75,74801,363152213,2019-01-30 09:22:58,"[arts and entertainment, biology, cnn, image, anime and manga, online communities]"
10,dgawlik/nyse,1273,0.85294116,75757,32148316,2017-02-22 10:18:25,"[business, finance, investing]"
11,ajaypalsinghlo/world-happiness-report-2021,1263,0.9705882,62402,56531,2021-03-22 16:51:01,"[healthcare, religion and belief systems, health, economics, beginner]"
12,arashnic/hr-analytics-job-change-of-data-scientists,1233,1.0,45172,301600,2020-12-07 00:25:10,"[business, education, intermediate, tabular, binary classification]"
13,dansbecker/melbourne-housing-snapshot,1231,0.7058824,110610,461423,2018-06-05 12:52:24,"[australia, housing, real estate, social science, demographics]"
14,netflix-inc/netflix-prize-data,1211,0.7647059,73918,716193814,2019-11-13 18:39:37,"[movies and tv shows, earth and nature, artificial intelligence, computer science]"
15,himanshupoddar/zomato-bangalore-restaurants,1211,1.0,51594,93341357,2019-03-31 09:48:43,"[finance, demographics, data visualization, k-means, restaurants]"
16,ealaxi/paysim1,1211,0.88235295,67117,186385561,2017-04-03 08:40:34,"[crime, finance]"
17,austinreese/craigslist-carstrucks-data,1198,1.0,58597,275237598,2021-05-06 17:14:08,"[united states, economics, automobiles and vehicles]"
18,adityakadiwal/water-potability,1171,1.0,53556,256729,2021-04-25 10:27:44,"[water bodies, public health, earth and nature, environment, energy, beginner, binary classification]"
0,ramamet4/app-store-apple-data-set-10k-apps,1166,0.8235294,59404,5905027,2018-06-10 07:04:28,"[business, internet, mobile and wireless]"
1,iarunava/cell-images-for-detecting-malaria,1163,0.625,41219,708172590,2018-12-05 05:40:21,[healthcare]
2,rohanrao/formula-1-world-championship-1950-2020,1154,1.0,46483,6039972,2023-03-07 04:48:17,"[auto racing, sports]"
3,CooperUnion/anime-recommendations-database,1152,0.8235294,45107,26259955,2016-12-21 04:58:34,"[popular culture, movies and tv shows, comics and animation, anime and manga]"
4,arjunprasadsarkhel/2021-olympics-in-tokyo,1151,0.8235294,55218,356012,2021-08-17 19:25:37,"[sports, categorical, data visualization, tabular, japan]"
5,uciml/sms-spam-collection-dataset,1154,0.7352941,129961,215934,2016-12-02 19:29:17,"[languages, linguistics, email and messaging]"
6,rtatman/188-million-us-wildfires,1126,0.8235294,24698,176270559,2020-05-12 21:03:49,[business]
7,openfoodfacts/world-food-facts,1125,0.7058824,58598,114050691,2017-09-18 12:27:58,"[alcohol, nutrition, earth and nature]"
8,datasnaek/chess,1105,0.8235294,35499,2903760,2017-09-04 03:09:09,"[games, board games, video games, internet]"
9,datasnaek/mbti-type,1079,0.88235295,29773,25621004,2017-09-22 14:00:59,"[demographics, linguistics, psychology, computer science, internet]"
10,kiva/data-science-for-good-kiva-crowdfunding,1054,0.85294116,22330,43895508,2018-03-02 20:20:57,"[geography, finance, lending, crowdfunding, economics, gambling]"
11,kaggle/kaggle-survey-2018,1032,0.85294116,19165,4405170,2018-11-03 22:35:07,"[games, earth and nature, business, education, computer science, survey analysis]"
12,Cornell-University/arxiv,1033,0.875,23090,1215803217,2023-03-18 23:50:54,"[earth and nature, education]"
13,rounakbanik/pokemon,1025,0.8235294,52919,47750,2017-09-29 19:49:32,"[popular culture, arts and entertainment, games, video games, earth and nature, anime and manga]"
14,mylesoneill/world-university-rankings,1012,0.7941176,76124,1482192,2019-11-13 18:48:56,[universities and colleges]
15,rtatman/chocolate-bar-ratings,1007,0.7647059,69758,31056,2017-08-11 23:25:42,[]
16,nih-chest-xrays/data,997,0.7352941,68383,45096150231,2018-02-21 20:52:23,"[biology, health, medicine, computer science, software, health conditions]"
17,sudalairajkumar/cryptocurrencypricehistory,979,0.9705882,72172,1782192,2021-07-07 06:39:23,"[history, finance, currencies and foreign exchange]"
18,sootersaalu/amazon-top-50-bestselling-books-2009-2019,973,1.0,48704,14857,2020-10-13 09:39:21,"[websites, literature, exploratory data analysis, data visualization, data analytics]"
19,nicapotato/womens-ecommerce-clothing-reviews,972,0.88235295,56465,2924120,2018-02-03 19:59:19,"[earth and nature, business, internet, nlp, text mining, ratings and reviews]"
0,osmi/mental-health-in-tech-survey,970,0.88235295,55511,49930,2016-11-03 17:28:47,"[mental health, healthcare, genetics, earth and nature, employment]"
1,heptapod/titanic,966,0.7058824,52603,11090,2017-05-16 08:14:22,[]
2,rush4ratio/video-game-sales-with-ratings,963,0.7647059,61546,487609,2016-12-30 15:33:11,"[arts and entertainment, music, video games, business, computer science]"
3,sulianova/cardiovascular-disease-dataset,963,0.64705884,59278,760066,2019-01-20 01:28:23,"[healthcare, health, heart conditions]"
4,crowdflower/twitter-airline-sentiment,962,0.8235294,82261,2678605,2019-10-16 00:04:05,"[health, linguistics, internet, aviation]"
5,tongpython/cat-and-dog,958,0.75,75421,228487605,2018-04-26 10:56:50,"[animals, deep learning]"
6,camnugent/sandp500,955,0.7647059,60051,20283917,2018-02-10 03:15:53,"[business, finance, investing]"
7,kumarajarshi/life-expectancy-who,953,0.8235294,88910,121472,2018-02-10 16:55:10,"[global, health, social science, data cleaning]"
8,joniarroba/noshowappointments,946,0.7058824,40065,2514014,2017-08-20 23:49:38,"[brazil, healthcare, public health, health]"
9,navoneel/brain-mri-images-for-brain-tumor-detection,947,0.5,53749,15828590,2019-04-14 15:15:54,"[biology, health, computer vision, classification, deep learning]"
10,meowmeowmeowmeowmeow/gtsrb-german-traffic-sign,945,0.8235294,78816,641568792,2018-11-25 18:12:34,"[classification, image, online communities]"
11,usdot/flight-delays,938,0.88235295,95032,200067268,2017-02-09 21:36:00,[aviation]
12,leonardopena/top50spotify2019,929,1.0,37384,2365,2019-08-08 16:39:46,[music]
13,gpiosenka/100-bird-species,926,0.9411765,39959,2033932139,2023-03-17 16:11:41,"[biology, computer vision, classification, cnn, image, tensorflow]"
14,shivam2503/diamonds,921,0.7647059,67731,750893,2017-05-25 03:06:57,"[clothing and accessories, finance]"
15,ikarus777/best-artworks-of-all-time,919,0.7058824,26456,2460161668,2019-03-02 09:21:51,"[arts and entertainment, art, computer science, classification, image]"
16,benroshan/factors-affecting-campus-placement,910,1.0,49434,4615,2020-04-11 11:09:02,"[universities and colleges, business, education, classification, deep learning, standardized testing]"
17,jameslko/gun-violence-data,903,0.85294116,36694,35266482,2018-04-15 06:18:09,"[crime, law, social science]"
18,piterfm/2022-ukraine-russian-war,898,1.0,21669,13240,2023-03-19 13:01:13,"[russia, history, business, military, time series analysis, tabular]"
19,abecklas/fifa-world-cup,899,0.88235295,59283,357710,2018-04-23 13:40:35,"[football, sports]"
0,crowww/a-large-scale-fish-dataset,891,0.9375,16538,3482438117,2021-04-28 17:03:01,"[computer science, computer vision, classification, image, fish and aquaria]"
1,jessicali9530/stanford-dogs-dataset,894,0.75,35254,786955428,2019-11-13 06:20:35,"[animals, image, multiclass classification]"
2,mylesoneill/game-of-thrones,882,0.85294116,38975,67721,2016-05-20 01:32:31,[literature]
3,rhuebner/human-resources-data-set,879,0.8235294,65273,17041,2020-10-19 13:50:53,"[employment, business]"
4,manjeetsingh/retaildataset,873,0.8235294,61788,3258525,2017-09-01 03:03:57,"[clothing and accessories, business, retail and shopping, investing]"
5,lakshmi25npathi/imdb-dataset-of-50k-movie-reviews,876,0.8235294,108724,26962657,2019-03-09 06:32:21,"[movies and tv shows, business, internet, text]"
6,rmisra/news-headlines-dataset-for-sarcasm-detection,871,1.0,36477,3460534,2019-07-03 23:52:57,"[earth and nature, linguistics, computer science, programming, nlp, classification, deep learning, news]"
7,kaggle/kaggle-survey-2017,868,0.8235294,27456,3692241,2017-10-27 22:03:03,"[earth and nature, employment, business, education, artificial intelligence, computer science]"
8,paultimothymooney/breast-histopathology-images,867,0.75,47815,3326820824,2017-12-19 05:46:40,"[health, medicine, image, binary classification, cancer]"
9,camnugent/california-housing-prices,861,0.85294116,91799,409382,2017-11-24 03:14:59,"[united states, housing, real estate, social science, computer science, programming, software, social issues and advocacy]"
10,uciml/default-of-credit-card-clients-dataset,844,0.7058824,59293,1025318,2016-11-03 03:39:18,"[earth and nature, finance, e-commerce services]"
11,bittlingmayer/amazonreviews,844,0.6875,58353,517080965,2019-11-18 02:50:34,"[earth and nature, business, education, linguistics, internet, nlp, text, ratings and reviews]"
12,rajeevw/ufcdata,844,0.9705882,26506,3876811,2021-03-21 11:26:34,"[sports, martial arts]"
13,residentmario/ramen-ratings,840,0.7058824,38382,40762,2018-01-11 16:04:39,"[asia, cooking and recipes, restaurants]"
14,anikannal/solar-power-generation-data,830,1.0,30902,1988756,2020-08-18 15:52:03,[renewable energy]
15,wsj/college-salaries,823,0.8235294,35149,16830,2017-04-29 15:48:55,"[universities and colleges, employment, business, education, jobs and career]"
16,grassknoted/asl-alphabet,819,0.875,42169,1100887034,2018-04-22 19:31:36,"[linguistics, computer vision, image, health conditions, social networks]"
17,robikscube/hourly-energy-consumption,816,1.0,47648,11979477,2018-08-30 14:17:03,"[research, united states, business, energy, electricity]"
18,tawsifurrahman/covid19-radiography-database,808,1.0,61966,816029038,2022-03-19 13:38:42,"[universities and colleges, dentistry, earth and nature, health, science and technology, classification, deep learning, image, transfer learning, covid19]"
19,utkarshxy/who-worldhealth-statistics-2020-complete,800,1.0,18050,1440599,2021-06-02 08:14:05,"[public health, earth and nature, health, public safety]"
0,ardamavi/sign-language-digits-dataset,782,0.625,25868,17623806,2017-12-24 16:08:56,"[languages, education, image, primary and secondary schools, social networks]"
1,nehalbirla/vehicle-dataset-from-cardekho,779,1.0,98564,299060,2023-01-14 19:35:33,"[business, automobiles and vehicles, linear regression]"
2,kaggle/sf-salaries,772,0.7058824,63669,12036742,2019-12-05 23:30:07,"[income, business, jobs and career]"
3,manasgarg/ipl,770,0.85294116,58686,1060442,2017-11-23 01:33:56,"[baseball, cricket, india]"
4,tunguz/big-five-personality-test,768,1.0,20898,166930361,2020-02-17 15:59:37,[psychology]
5,primaryobjects/voicegender,768,0.7058824,34493,415156,2016-08-26 14:29:23,"[arts and entertainment, earth and nature, gender, linguistics]"
6,paultimothymooney/blood-cells,768,0.7058824,32841,113386997,2018-04-21 21:06:13,"[biology, medicine, classification, image, health conditions]"
7,drgilermo/nba-players-stats,762,0.6764706,44746,2232495,2018-04-27 12:23:27,"[video games, basketball, sports]"
8,sudalairajkumar/indian-startup-funding,759,1.0,47449,122812,2020-02-11 16:18:55,"[india, business, finance, lending]"
9,anandhuh/latest-covid19-india-statewise-data,746,1.0,24056,1382,2023-01-17 09:41:02,"[india, social science, exploratory data analysis, data visualization, covid19]"
10,msambare/fer2013,750,0.75,57529,63252113,2020-07-19 12:24:26,"[arts and entertainment, art]"
11,fernandol/countries-of-the-world,738,0.8235294,50573,13735,2018-04-26 08:16:27,"[global, categorical, social science]"
12,chicago/chicago-crime,737,0.7058824,0,,2018-04-17 21:52:18,"[united states, crime, bigquery]"
13,kaggle/meta-kaggle,733,0.8235294,14389,6475112720,2023-03-23 09:02:21,[computer science]
14,rounakbanik/ted-talks,730,0.88235295,30607,12603111,2017-09-25 21:14:33,"[earth and nature, linguistics, internet]"
15,kmader/siim-medical-images,729,0.7647059,32184,261989898,2017-05-23 07:03:06,"[healthcare, health, image, health conditions]"
16,annavictoria/speed-dating-experiment,721,0.5882353,43774,382475,2016-05-09 15:14:15,[online communities]
17,passnyc/data-science-for-good,718,0.85294116,9858,167791,2018-06-26 17:36:48,"[games, business, education, demographics, computer science, data visualization]"
18,miroslavsabo/young-people-survey,712,0.85294116,40269,85769,2016-12-06 03:10:30,"[movies and tv shows, earth and nature, education, demographics, psychology]"
19,tristan581/17k-apple-app-store-strategy-games,709,1.0,22234,8833406,2019-08-26 08:22:16,"[video games, internet, mobile and wireless]"
0,gustavomodelli/forest-fires-in-brazil,709,0.9411765,30850,31859,2019-08-24 16:09:16,[business]
1,shayanfazeli/heartbeat,705,0.5882353,53515,103633768,2018-05-31 18:47:34,"[healthcare, health, classification, deep learning, health conditions, heart conditions]"
2,nasa/kepler-exoplanet-search-results,706,0.8235294,12080,1215549,2017-10-10 18:26:59,"[earth and nature, astronomy, business, science and technology]"
3,aljarah/xAPI-Edu-Data,702,0.7352941,57669,5675,2016-11-26 21:58:24,"[earth and nature, business, education]"
4,adityadesai13/used-car-dataset-ford-and-mercedes,700,1.0,29764,1152744,2020-07-04 11:30:07,[automobiles and vehicles]
